{
  "$schema": "https://json-schema.org/draft/2020-12/schema",
  "type": "object",
  "properties": {
    "contentDefaults": {
      "default": {
        "announcements": {
          "draft": false,
          "visibility": {
            "directory": true,
            "feed": true,
            "homepage": true,
            "search": true
          }
        },
        "articles": {
          "draft": false,
          "pdf": {
            "enabled": true
          },
          "visibility": {
            "directory": true,
            "feed": true,
            "homepage": true,
            "search": true
          }
        }
      },
      "type": "object",
      "properties": {
        "announcements": {
          "default": {
            "draft": false,
            "visibility": {
              "directory": true,
              "feed": true,
              "homepage": true,
              "search": true
            }
          },
          "type": "object",
          "properties": {
            "draft": {
              "default": false,
              "type": "boolean"
            },
            "visibility": {
              "default": {
                "directory": true,
                "feed": true,
                "homepage": true,
                "search": true
              },
              "type": "object",
              "properties": {
                "directory": {
                  "default": true,
                  "type": "boolean"
                },
                "feed": {
                  "default": true,
                  "type": "boolean"
                },
                "homepage": {
                  "default": true,
                  "type": "boolean"
                },
                "search": {
                  "default": true,
                  "type": "boolean"
                }
              },
              "additionalProperties": false
            }
          },
          "additionalProperties": false
        },
        "articles": {
          "default": {
            "draft": false,
            "pdf": {
              "enabled": true
            },
            "visibility": {
              "directory": true,
              "feed": true,
              "homepage": true,
              "search": true
            }
          },
          "type": "object",
          "properties": {
            "draft": {
              "default": false,
              "type": "boolean"
            },
            "visibility": {
              "default": {
                "directory": true,
                "feed": true,
                "homepage": true,
                "search": true
              },
              "type": "object",
              "properties": {
                "directory": {
                  "default": true,
                  "type": "boolean"
                },
                "feed": {
                  "default": true,
                  "type": "boolean"
                },
                "homepage": {
                  "default": true,
                  "type": "boolean"
                },
                "search": {
                  "default": true,
                  "type": "boolean"
                }
              },
              "additionalProperties": false
            },
            "pdf": {
              "default": {
                "enabled": true
              },
              "type": "object",
              "properties": {
                "enabled": {
                  "default": true,
                  "type": "boolean"
                }
              },
              "additionalProperties": false
            }
          },
          "additionalProperties": false
        }
      },
      "additionalProperties": false
    },
    "features": {
      "default": {
        "announcements": true,
        "authors": true,
        "bibliography": true,
        "categories": true,
        "collections": true,
        "feed": true,
        "pdf": true,
        "search": true,
        "support": true,
        "tags": true,
        "themeToggle": true
      },
      "type": "object",
      "properties": {
        "announcements": {
          "default": true,
          "type": "boolean"
        },
        "authors": {
          "default": true,
          "type": "boolean"
        },
        "bibliography": {
          "default": true,
          "type": "boolean"
        },
        "categories": {
          "default": true,
          "type": "boolean"
        },
        "collections": {
          "default": true,
          "type": "boolean"
        },
        "feed": {
          "default": true,
          "type": "boolean"
        },
        "pdf": {
          "default": true,
          "type": "boolean"
        },
        "search": {
          "default": true,
          "type": "boolean"
        },
        "support": {
          "default": true,
          "type": "boolean"
        },
        "tags": {
          "default": true,
          "type": "boolean"
        },
        "themeToggle": {
          "default": true,
          "type": "boolean"
        }
      },
      "additionalProperties": false
    },
    "homepage": {
      "default": {
        "announcementLimit": 3,
        "featuredCollection": "featured",
        "recentLimit": 8,
        "startHereCollection": "start-here"
      },
      "type": "object",
      "properties": {
        "announcementLimit": {
          "default": 3,
          "type": "integer",
          "exclusiveMinimum": 0,
          "maximum": 9007199254740991
        },
        "featuredCollection": {
          "default": "featured",
          "type": "string",
          "minLength": 1
        },
        "recentLimit": {
          "default": 8,
          "type": "integer",
          "exclusiveMinimum": 0,
          "maximum": 9007199254740991
        },
        "startHereCollection": {
          "default": "start-here",
          "type": "string",
          "minLength": 1
        }
      },
      "additionalProperties": false
    },
    "identity": {
      "type": "object",
      "properties": {
        "description": {
          "type": "string",
          "minLength": 1
        },
        "language": {
          "type": "string",
          "minLength": 2
        },
        "publisherName": {
          "type": "string",
          "minLength": 1
        },
        "shortTitle": {
          "type": "string",
          "minLength": 1
        },
        "timezone": {
          "type": "string",
          "minLength": 1
        },
        "title": {
          "type": "string",
          "minLength": 1
        },
        "url": {
          "type": "string",
          "format": "uri"
        }
      },
      "required": ["description", "language", "title", "url"],
      "additionalProperties": false
    },
    "navigation": {
      "type": "object",
      "properties": {
        "footer": {
          "default": [],
          "type": "array",
          "items": {
            "type": "object",
            "properties": {
              "href": {
                "type": "string",
                "minLength": 1
              },
              "label": {
                "type": "string",
                "minLength": 1
              }
            },
            "required": ["href", "label"],
            "additionalProperties": false
          }
        },
        "primary": {
          "default": [],
          "type": "array",
          "items": {
            "type": "object",
            "properties": {
              "href": {
                "type": "string",
                "minLength": 1
              },
              "label": {
                "type": "string",
                "minLength": 1
              }
            },
            "required": ["href", "label"],
            "additionalProperties": false
          }
        }
      },
      "additionalProperties": false
    },
    "routes": {
      "type": "object",
      "properties": {
        "allArticles": {
          "type": "string",
          "minLength": 1
        },
        "announcements": {
          "type": "string",
          "minLength": 1
        },
        "articles": {
          "type": "string",
          "minLength": 1
        },
        "authors": {
          "type": "string",
          "minLength": 1
        },
        "bibliography": {
          "type": "string",
          "minLength": 1
        },
        "categories": {
          "type": "string",
          "minLength": 1
        },
        "collections": {
          "type": "string",
          "minLength": 1
        },
        "feed": {
          "type": "string",
          "minLength": 1
        },
        "home": {
          "type": "string",
          "minLength": 1
        },
        "search": {
          "type": "string",
          "minLength": 1
        },
        "tags": {
          "type": "string",
          "minLength": 1
        }
      },
      "required": [
        "allArticles",
        "announcements",
        "articles",
        "authors",
        "bibliography",
        "categories",
        "collections",
        "feed",
        "home",
        "search",
        "tags"
      ],
      "additionalProperties": false
    },
    "share": {
      "default": {},
      "type": "object",
      "properties": {
        "threadsMention": {
          "type": "string",
          "minLength": 1
        },
        "xViaHandle": {
          "type": "string",
          "minLength": 1
        }
      },
      "additionalProperties": false
    },
    "support": {
      "type": "object",
      "properties": {
        "block": {
          "type": "object",
          "properties": {
            "body": {
              "type": "string",
              "minLength": 1
            },
            "title": {
              "type": "string",
              "minLength": 1
            }
          },
          "required": ["body", "title"],
          "additionalProperties": false
        },
        "discord": {
          "type": "object",
          "properties": {
            "ariaLabel": {
              "type": "string",
              "minLength": 1
            },
            "href": {
              "type": "string",
              "format": "uri"
            },
            "label": {
              "type": "string",
              "minLength": 1
            }
          },
          "required": ["href", "label"],
          "additionalProperties": false
        },
        "patreon": {
          "type": "object",
          "properties": {
            "ariaLabel": {
              "type": "string",
              "minLength": 1
            },
            "href": {
              "type": "string",
              "format": "uri"
            },
            "label": {
              "type": "string",
              "minLength": 1
            },
            "compactLabel": {
              "type": "string",
              "minLength": 1
            }
          },
          "required": ["href", "label"],
          "additionalProperties": false
        }
      },
      "required": ["block", "discord", "patreon"],
      "additionalProperties": false
    }
  },
  "required": ["identity", "navigation", "routes", "support"],
  "additionalProperties": false,
  "$id": "https://thephilosophersmeme.com/schemas/site-config.schema.json",
  "description": "Validated site-owner configuration for the TPM Astro blogging platform.",
  "title": "TPM Platform Site Config"
}
