{
  "identity": {
    "description": "The philosophy of memes, cyberculture, and the Internet.",
    "language": "en",
    "publisherName": "The Philosopher's Meme",
    "shortTitle": "TPM",
    "timezone": "America/New_York",
    "title": "The Philosopher's Meme",
    "url": "https://thephilosophersmeme.com"
  },
  "navigation": {
    "footer": [
      {
        "href": "/articles/",
        "label": "Articles"
      },
      {
        "href": "/articles/all/",
        "label": "All Articles"
      },
      {
        "href": "/collections/",
        "label": "Collections"
      },
      {
        "href": "/announcements/",
        "label": "Announcements"
      },
      {
        "href": "/collections/featured/",
        "label": "Featured Articles"
      },
      {
        "href": "/authors/",
        "label": "Authors"
      },
      {
        "href": "/tags/",
        "label": "Tags"
      },
      {
        "href": "/bibliography/",
        "label": "Bibliography"
      },
      {
        "href": "/about/",
        "label": "About"
      },
      {
        "href": "/feed.xml",
        "label": "RSS"
      }
    ],
    "primary": [
      {
        "href": "/articles/",
        "label": "Articles"
      },
      {
        "href": "/about/",
        "label": "About"
      }
    ]
  },
  "routes": {
    "allArticles": "/articles/all/",
    "announcements": "/announcements/",
    "articles": "/articles/",
    "authors": "/authors/",
    "bibliography": "/bibliography/",
    "categories": "/categories/",
    "collections": "/collections/",
    "feed": "/feed.xml",
    "home": "/",
    "search": "/search/",
    "tags": "/tags/"
  },
  "share": {
    "threadsMention": "@the_philosophers_meme",
    "xViaHandle": "philo_meme"
  },
  "support": {
    "block": {
      "body": "Help keep independent research and writing going.",
      "title": "Support The Philosopher's Meme"
    },
    "discord": {
      "ariaLabel": "Join the TPM Discord",
      "href": "https://discord.gg/8MVFRMa",
      "label": "Join Discord"
    },
    "patreon": {
      "ariaLabel": "Support The Philosopher's Meme on Patreon",
      "compactLabel": "Patreon",
      "href": "https://patreon.com/thephilosophersmeme",
      "label": "Support Us"
    }
  }
}
